{
  "schemaVersion": 1,
  "profile": {
    "id": "darwin-arm64-development-v1",
    "label": "development characterization on this recorded profile",
    "os": "darwin",
    "architecture": "arm64",
    "ceilings": {
      "backendReadyMs": 120000,
      "backendShutdownMs": 15000,
      "browserJourneyMs": 120000,
      "suiteMs": 7200000,
      "backendMemoryHardLimitBytes": 1073741824
    }
  },
  "invariants": {
    "frontendInitialJavaScriptGzipBytes": {
      "comparison": "lt",
      "value": 307200,
      "unit": "bytes"
    },
    "backendQueryTestBinaryBytes": {
      "comparison": "lte",
      "value": 16777216,
      "unit": "bytes"
    },
    "apiRequestMs": {
      "comparison": "lt",
      "value": 30000,
      "unit": "milliseconds"
    },
    "cacheResultItems": {
      "comparison": "lte",
      "value": 512,
      "unit": "items"
    },
    "cacheResultBytes": {
      "comparison": "lte",
      "value": 199229440,
      "unit": "bytes"
    },
    "cacheResultPerItemBytes": {
      "comparison": "lte",
      "value": 33554432,
      "unit": "bytes"
    }
  },
  "timeouts": {
    "commandMs": 3600000,
    "archiveCopyMs": 900000,
    "runtimeMs": 600000,
    "browserCellMs": 120000,
    "suiteMs": 7200000,
    "gracefulStopMs": 15000
  }
}
